{
  "$schema": "https://json-schema.org/draft/2020-12/schema",
  "$id": "assurance-context-binding.schema.json",
  "title": "Assurance Context Binding",
  "description": "Reference-only binding of subject, configuration, and evidence context. Authority effect remains NONE. Material change invalidates prior binding. Does not implement runtime detection.",
  "type": "object",
  "properties": {
    "binding_id": { "type": "string", "minLength": 1 },
    "subject_id": { "type": "string", "minLength": 1 },
    "configuration_digest": {
      "type": "string",
      "pattern": "^sha256:[a-f0-9]{64}$"
    },
    "context_boundary": { "type": "string", "minLength": 1 },
    "evidence_provenance": {
      "type": "object",
      "properties": {
        "source": { "type": "string", "minLength": 1 },
        "timestamp": { "type": "string", "minLength": 1 },
        "digest": {
          "type": "string",
          "pattern": "^sha256:[a-f0-9]{64}$"
        }
      },
      "required": ["source", "timestamp", "digest"],
      "additionalProperties": false
    },
    "validity_from": { "type": "string", "minLength": 1 },
    "invalidation_triggers": {
      "type": "array",
      "minItems": 1,
      "items": { "type": "string", "minLength": 1 }
    },
    "reference_only": { "type": "boolean", "const": true },
    "authority_effect": { "type": "string", "const": "NONE" }
  },
  "required": [
    "binding_id",
    "subject_id",
    "configuration_digest",
    "context_boundary",
    "evidence_provenance",
    "validity_from",
    "invalidation_triggers",
    "reference_only",
    "authority_effect"
  ],
  "additionalProperties": false
}
